name,email,phone,company,status,notes
John Doe,john.doe@example.com,+1-555-0100,Acme Corporation,new,Interested in enterprise plan
Jane Smith,jane.smith@techsolutions.com,555-0101,Tech Solutions Inc,contacted,Follow up scheduled for next week
Bob Johnson,bob.j@startup.io,+1 (555) 0102,Startup Inc,qualified,Ready to move forward with proposal
Alice Williams,alice.w@consulting.com,555-0103,Williams Consulting,pending,Waiting for budget approval
Charlie Brown,charlie@example.org,,Brown Enterprises,new,Met at conference
Diana Prince,diana.prince@corp.com,+1-555-0105,Global Corp,contacted,Requested product demo
